{
  "id": "best-smartphones-photography-2026",
  "title": "Best Smartphones for Mobile Photography (Buyer's Guide 2026)",
  "subtitle": "Add a concise subtitle that explains the article angle.",
  "author": "GAIOS",
  "date": "2026-04-04",
  "category": "NEWS",
  "tags": [
    "Tech"
  ],
  "image": "images/articles/best-smartphones-photography-2026.jpg",
  "content": "<p>Start with a clear introduction that explains why this topic matters now and what the reader will learn.</p>\n\n<h2>Main angle</h2>\n<p>Develop the core argument with concrete, current and verifiable information. Keep the writing useful, specific and aligned with the final title.</p>\n\n<h2>What matters in practice</h2>\n<p>Explain the real-world implications, trade-offs and buying or usage context. Replace this starter text before publishing.</p>"
}
