{
  "id": "smart-home-innovative-gadgets-2025",
  "title": "Smart Home 2025: Innovative Gadgets That Actually Improve Daily Life",
  "subtitle": "Matter stability, reliable sensors, and automations that stick",
  "author": "Technova Team",
  "date": "2025-12-15",
  "category": "NEWS",
  "tags": [
    "Tech",
    "Smart Home",
    "IoT",
    "Accessories"
  ],
  "image": "images/articles/generated/smart-home-innovative-gadgets-2025-fallback-0.svg",
  "gallery": [
    {
      "src": "images/articles/generated/smart-home-innovative-gadgets-2025-fallback-1.svg",
      "alt": "Smart light and speaker",
      "caption": "Stable connectivity and simple controls matter more than flashy effects."
    },
    {
      "src": "images/articles/generated/smart-home-innovative-gadgets-2025-fallback-2.svg",
      "alt": "Smart thermostat",
      "caption": "Energy savings come from reliable schedules and sensors, not hype."
    }
  ],
  "affiliateLinks": [
    {
      "label": "Shop Smart Home Devices",
      "url": "https://www.amazon.com/s?k=smart+home&tag=kimsondreams-20"
    }
  ],
  "content": "<p>Smart home gadgets in 2025 finally prioritize reliability over spectacle. The biggest win is Matter’s broad adoption—lights, sensors and hubs pair faster, hold connections and survive app reshuffles. The result is an ecosystem that feels stable: routines trigger on time, scenes stay synchronized and devices don’t mysteriously vanish after updates. For most homes, the most useful upgrades are simple ones: responsive bulbs, accurate motion and door sensors, and a thermostat that follows schedules without nagging.</p><p>Sensors are the backbone of good automations. Accurate motion detection reduces false triggers, while contact sensors make notifications and routines dependable. Thermostats that integrate weather and occupancy data save energy without sacrificing comfort. Cameras benefit from clearer night performance and smarter alerts that reduce noise; local storage and privacy controls are now standard in better models.</p><p>Voice assistants and dashboards work best when kept minimal—clear labels, quick toggles and no nested menus for common actions. Power users will appreciate rule engines that allow complex conditions, but most households need just a few clean routines: morning lights, away mode and bedtime scenes. The trick is maintaining trust: no random disconnects, no unintelligible error codes.</p><p>The smartest home is the one that quietly works every day. Pick devices known for stable firmware, privacy‑respecting defaults and a track record of updates. Resist novelty for its own sake; precise sensors and simple controls make life smoother and energy cheaper.</p>"
}
