{
  "id": "iphone-se-4-vs-pixel-10a-comparison",
  "title": "The Best Budget Flagships of 2026: iPhone SE 4 vs. Google Pixel 10a",
  "subtitle": "A comprehensive comparison of the two most anticipated mid-range smartphones of the year.",
  "author": "Technova Team",
  "date": "2026-03-06",
  "category": "COMPARISONS",
  "tags": [
    "Tech",
    "Smartphone",
    "Apple",
    "Google",
    "iPhone SE 4",
    "Pixel 10a",
    "Comparison",
    "AI"
  ],
  "image": "images/articles/iphone-se-4-vs-pixel-10a-main.jpg",
  "content": "<p>The landscape of mid-range smartphones has shifted dramatically in 2026. No longer does 'budget' imply a compromise in performance or essential features. With the release of the iPhone SE 4 and the Google Pixel 10a, the $500 price bracket now offers technology that was reserved for ultra-premium flagships just two years ago.</p>\n\n<h2>Design and Display: Modern Aesthetics on a Budget</h2>\n\n<h3>iPhone SE 4: The End of the Home Button</h3>\n<p>Apple has finally retired the iconic Home button in the SE line. The iPhone SE 4 adopts the modern iPhone 14-style chassis, featuring a 6.1-inch OLED Super Retina XDR display. This transition brings Face ID to the budget segment for the first time, along with the sleek, flat-edge design that has defined the modern iPhone era. The move to USB-C is now standard, making it more versatile than ever.</p>\n\n<div class=\"article-image-wrapper\">\n    <img src=\"images/articles/iphone-se-4-design.jpg\" alt=\"iPhone SE 4 modern design with 6.1-inch OLED display\" class=\"article-image\">\n    <p class=\"image-caption\">The iPhone SE 4 finally embraces the all-screen design.</p>\n</div>\n\n<h3>Pixel 10a: Refined Minimalism</h3>\n<p>Google's Pixel 10a continues the evolution of the 'G-wrap' camera bar, now more integrated into the frame for a cleaner look. The standout feature is the 6.1-inch Actua display, which now supports a 120Hz refresh rate\u2014a significant advantage over the SE 4's 60Hz panel. The Pixel 10a feels incredibly premium in the hand, utilizing recycled aluminum and high-quality matte plastics.</p>\n\n<h2>Performance and AI: The Battle of Silicon</h2>\n\n<h3>Apple A19 and Apple Intelligence</h3>\n<p>Under the hood, the iPhone SE 4 is powered by the A19 chip, the same silicon found in the standard iPhone 17. This isn't just about raw speed; it's about <b>Apple Intelligence</b>. With 8GB of RAM as the new baseline, the SE 4 handles on-device AI tasks like Writing Tools, Image Playground, and the revamped Siri with ease, making it a future-proof powerhouse.</p>\n\n<h3>Tensor G5: Google's AI Powerhouse</h3>\n<p>The Pixel 10a marks a historic milestone: the debut of the Tensor G5, Google's first fully custom-designed chip manufactured by TSMC. This move has solved the thermal and efficiency issues of previous generations. The Tensor G5 is built specifically for Gemini, enabling advanced on-device features like real-time video translation, Magic Editor Pro, and sophisticated call screening that feels more human than ever.</p>\n\n<h2>Camera Systems: Computational Photography vs. Hardware Prowess</h2>\n<p>Apple sticks to a single-lens philosophy for the SE 4, but it's a formidable 48MP sensor capable of 2x 'optical-quality' crop. It excels in video recording and natural skin tones. On the other hand, the Pixel 10a offers a dual-lens system (Wide and Ultrawide). Google's computational photography remains the king of still images, particularly in Night Sight and HDR+ processing, giving it the edge for photography enthusiasts.</p>\n\n<h2>Price and Availability: Which Offers Better Value?</h2>\n<p>The iPhone SE 4 is expected to start at $499, while the Pixel 10a is positioned at $549. Both companies are offering aggressive trade-in incentives to lure users into their respective ecosystems. When you consider the 7 years of software updates promised by Google and the incredible resale value of iPhones, both devices represent the best value in the 2026 market.</p>\n\n<div class=\"product-recommendation\">\n    <h3>Where to Buy</h3>\n    <p>Check the latest deals and availability for these budget flagships on Amazon:</p>\n    <ul>\n        <li><a href=\"https://www.amazon.com/s?k=iphone+se+4&tag=kimsondreams-21\" target=\"_blank\" rel=\"noopener\">Shop iPhone SE 4 on Amazon</a></li>\n        <li><a href=\"https://www.amazon.com/s?k=pixel+10a&tag=kimsondreams-21\" target=\"_blank\" rel=\"noopener\">Shop Google Pixel 10a on Amazon</a></li>\n    </ul>\n</div>\n\n<h2>The Verdict: Which Budget Flagship Should You Buy?</h2>\n<p>The choice between the iPhone SE 4 and the Pixel 10a ultimately comes down to your ecosystem preference. If you want the best-in-class video, iMessage, and a chip that will last for half a decade, the <b>iPhone SE 4</b> is the clear winner. However, if you value a superior 120Hz display, versatile dual cameras, and the most advanced AI assistant features, the <b>Pixel 10a</b> is the best budget phone Google has ever made.</p>"
}