{
  "id": "ai-assistants-comparison-2025",
  "title": "Best AI Assistants 2025: ChatGPT vs Claude vs Gemini Compared",
  "subtitle": "A comprehensive comparison of the leading AI assistants to help you choose the right one for your needs",
  "author": "Technova Team",
  "date": "2025-01-27",
  "category": "COMPARISONS",
  "tags": [
    "AI",
    "Tech",
    "Productivity"
  ],
  "image": "images/articles/cover_ai-assistants-comparison-2025_1771429979469.jpg",
  "content": "<p>The AI assistant landscape has evolved dramatically in 2025, with three major players dominating the market: OpenAI's ChatGPT, Anthropic's Claude, and Google's Gemini. Each offers unique strengths and capabilities that cater to different user needs. In this comprehensive comparison, we'll break down everything you need to know to choose the right AI assistant for your workflow.</p><h2>ChatGPT: The Pioneer</h2><p>OpenAI's ChatGPT remains the most recognized name in AI assistants. With the release of GPT-4 Turbo and continued improvements throughout 2025, ChatGPT offers exceptional versatility and a massive ecosystem of plugins and integrations.</p><h3>Key Features</h3><ul><li><strong>GPT-4 Turbo:</strong> Enhanced reasoning and faster response times</li><li><strong>DALL-E Integration:</strong> Built-in image generation capabilities</li><li><strong>Code Interpreter:</strong> Execute Python code and analyze data directly</li><li><strong>Plugin Ecosystem:</strong> Hundreds of third-party integrations</li><li><strong>Voice Mode:</strong> Natural conversation with real-time voice interaction</li></ul><h3>Pricing</h3><p>ChatGPT offers a free tier with GPT-3.5 access, while ChatGPT Plus at $20/month provides GPT-4 Turbo access, priority during peak times, and advanced features. Enterprise plans offer additional security and customization options.</p><h3>Best For</h3><p>General-purpose tasks, creative writing, coding assistance, and users who want extensive plugin integrations.</p><h2>Claude: The Thoughtful Analyst</h2><p>Anthropic's Claude has emerged as a serious competitor with its focus on safety, nuanced reasoning, and handling of long-form content. Claude 3 Opus represents the pinnacle of Anthropic's constitutional AI approach.</p><h3>Key Features</h3><ul><li><strong>200K Context Window:</strong> Process extremely long documents in a single conversation</li><li><strong>Constitutional AI:</strong> Built-in safety measures and ethical considerations</li><li><strong>Nuanced Analysis:</strong> Exceptional at understanding context and providing balanced perspectives</li><li><strong>Document Processing:</strong> Upload and analyze PDFs, images, and code files</li><li><strong>Artifacts:</strong> Create interactive code previews and visualizations</li></ul><h3>Pricing</h3><p>Claude offers a free tier with limited usage. Claude Pro at $20/month provides priority access to Claude 3 Opus, increased usage limits, and early access to new features. Team and Enterprise plans available for organizations.</p><h3>Best For</h3><p>Research, long-form content analysis, academic work, and users who prioritize thoughtful, nuanced responses over speed.</p><h2>Gemini: The Multimodal Powerhouse</h2><p>Google's Gemini leverages the company's vast data resources and search capabilities to offer a uniquely integrated AI experience. Gemini Ultra and Gemini 1.5 Pro showcase Google's multimodal AI advancement.</p><h3>Key Features</h3><ul><li><strong>Native Multimodal:</strong> Process text, images, audio, and video seamlessly</li><li><strong>Google Integration:</strong> Deep integration with Gmail, Docs, Drive, and Search</li><li><strong>1M Token Context:</strong> Industry-leading context window for massive documents</li><li><strong>Real-time Information:</strong> Access to current information through Google Search</li><li><strong>Workspace Integration:</strong> Built into Google's productivity suite</li></ul><h3>Pricing</h3><p>Gemini offers a free tier with Gemini Pro. Gemini Advanced at $19.99/month (included with Google One AI Premium) provides access to Gemini Ultra, 2TB storage, and Gemini in Gmail and Docs. Enterprise pricing available through Google Workspace.</p><h3>Best For</h3><p>Users deep in the Google ecosystem, multimodal tasks involving images and video, and those who need real-time information access.</p><h2>Head-to-Head Comparison</h2><table><tr><th>Feature</th><th>ChatGPT</th><th>Claude</th><th>Gemini</th></tr><tr><td>Context Window</td><td>128K tokens</td><td>200K tokens</td><td>1M tokens</td></tr><tr><td>Image Generation</td><td>Yes (DALL-E)</td><td>No</td><td>Yes (Imagen)</td></tr><tr><td>Code Execution</td><td>Yes</td><td>No</td><td>Limited</td></tr><tr><td>Voice Mode</td><td>Yes</td><td>No</td><td>Yes</td></tr><tr><td>Real-time Info</td><td>With Plugins</td><td>No</td><td>Yes</td></tr><tr><td>Price (Pro)</td><td>$20/month</td><td>$20/month</td><td>$19.99/month</td></tr></table><h2>Use Case Recommendations</h2><h3>For Developers</h3><p><strong>Winner: ChatGPT</strong> - The Code Interpreter feature and extensive plugin ecosystem make it ideal for coding tasks, debugging, and technical documentation.</p><h3>For Researchers and Academics</h3><p><strong>Winner: Claude</strong> - The massive context window and nuanced analysis capabilities make Claude perfect for processing research papers and conducting literature reviews.</p><h3>For Content Creators</h3><p><strong>Winner: Gemini</strong> - Native multimodal capabilities and Google Workspace integration streamline content creation workflows across text, images, and video.</p><h3>For Business Professionals</h3><p><strong>Winner: Tie (depends on ecosystem)</strong> - Choose ChatGPT for Microsoft integration, Gemini for Google Workspace users.</p><h2>The Verdict</h2><p>There's no single \"best\" AI assistant in 2025 - the right choice depends entirely on your specific needs and existing workflow. ChatGPT excels at versatility and coding, Claude shines in deep analysis and long-form content, while Gemini dominates multimodal tasks and Google ecosystem integration.</p><p>Our recommendation: Most users will benefit from trying all three during their free tiers to understand which AI assistant's \"thinking style\" aligns best with their work. Many power users maintain subscriptions to multiple services, using each for its unique strengths.</p><div class=\"product-recommendation\"><h3>Get Started with AI Assistants</h3><p>Ready to boost your productivity with AI? Check out these accessories to enhance your AI workflow:</p><ul><li><a href=\"https://www.amazon.com/s?k=mechanical+keyboard+for+typing&tag=kimsondreams-21\" target=\"_blank\" rel=\"noopener\">Mechanical Keyboards for Extended Typing</a></li><li><a href=\"https://www.amazon.com/s?k=ultrawide+monitor+productivity&tag=kimsondreams-21\" target=\"_blank\" rel=\"noopener\">Ultrawide Monitors for Multitasking</a></li><li><a href=\"https://www.amazon.com/s?k=noise+cancelling+headphones&tag=kimsondreams-21\" target=\"_blank\" rel=\"noopener\">Noise-Cancelling Headphones for Focus</a></li></ul></div>"
}