{
  "id": "samsung-galaxy-s25-ultra-review",
  "title": "Samsung Galaxy S25 Ultra Review: The New AI Powerhouse",
  "subtitle": "Samsung's 2025 flagship redefines the smartphone experience with Galaxy AI and the Snapdragon 8 Elite.",
  "author": "Technova Team",
  "date": "2025-01-25",
  "category": "REVIEWS",
  "tags": [
    "Tech",
    "Samsung",
    "Smartphone",
    "Review",
    "AI"
  ],
  "image": "images/articles/s25-ultra-display.jpg",
  "content": "<p>The Samsung Galaxy S25 Ultra has officially arrived, and it sets a new benchmark for what a flagship smartphone should be in 2025. With a refined titanium frame and a flatter display, it's the most ergonomic Ultra model yet.</p><h2>The Power of Snapdragon 8 Elite</h2><p>Under the hood, the S25 Ultra is powered by the Snapdragon 8 Elite chipset. This new architecture delivers incredible performance gains, especially in AI processing. Whether you're gaming at max settings or using complex Galaxy AI features like Live Translate or Note Assist, the phone remains cool and incredibly responsive.</p><h2>Display and Design</h2><p>The 6.8-inch Dynamic AMOLED 2X display is brighter than ever, reaching up to 2600 nits of peak brightness. Samsung has also improved the anti-reflective coating, making it the best screen for outdoor use. The symmetrical bezels and the new rounded corners make it much more comfortable to hold for long periods.</p><h2>Camera Excellence</h2><p>The 200MP main sensor returns with improved processing, but the real star is the new 50MP ultra-wide and 50MP 5x telephoto lenses. The consistency across all sensors is remarkable, and the 8K video recording is smoother thanks to enhanced OIS and VDIS technology.</p><div class=\"product-recommendation\"><h3>Where to Buy</h3><p>The Samsung Galaxy S25 Ultra is available now on Amazon. You can find the latest deals and bundles via the link below:</p><p><a href=\"https://www.amazon.com/dp/B0DR5S6R9C?tag=kimsondreams-21\" target=\"_blank\" rel=\"noopener\">Check Samsung Galaxy S25 Ultra Price on Amazon</a></p></div>"
}