{
  "id": "best-tech-gadgets-amazon-2025",
  "title": "Best Tech Gadgets on Amazon 2025: Ultimate Buyer Guide",
  "subtitle": "Discover the hottest smartphones, audio gear, laptops, and smart home devices available on Amazon right now",
  "author": "Technova Team",
  "date": "2025-01-23",
  "category": "REVIEWS",
  "tags": [
    "Tech",
    "Gadgets",
    "Amazon",
    "Smartphone",
    "Audio",
    "Laptop",
    "Smart Home"
  ],
  "image": "images/articles/tech-gadgets-2025-main.jpg",
  "content": "<p>Looking for the best tech gadgets on Amazon in 2025? You have come to the right place. We have curated the ultimate selection of trending devices across smartphones, audio equipment, laptops, gaming gear, and smart home technology.</p><h2>Smartphones and Wearables</h2><h3>iPhone 16 Pro Max</h3><p>Apple flagship smartphone with A18 Pro chip, 48MP camera system, and 6.9-inch Super Retina XDR display. Titanium design makes it lighter than ever.</p><h3>Samsung Galaxy S25 Ultra</h3><p>Samsung latest flagship with Snapdragon 8 Gen 4, 200MP camera, and S Pen. Galaxy AI features make this the smartest Android phone yet.</p><h2>Audio and Headphones</h2><h3>Sony WH-1000XM5</h3><p>Industry-leading noise cancellation with 30mm drivers and 30-hour battery life.</p><h3>AirPods Pro 2nd Generation</h3><p>Apple premium earbuds with adaptive audio and personalized spatial audio.</p><h2>Laptops and Gaming</h2><h3>MacBook Air 15-inch M3</h3><p>The larger MacBook Air with M3 chip and up to 18 hours of battery life.</p><h3>ASUS ROG Zephyrus G14 2025</h3><p>Gaming laptop with AMD Ryzen 9 and NVIDIA RTX 5070 in a 14-inch form factor.</p><h2>Smart Home</h2><h3>Ring Video Doorbell Pro 2</h3><p>3D motion detection and bird eye view for security awareness.</p><h3>Amazon Echo Show 15</h3><p>15.6-inch smart display serving as a family hub.</p><h2>Final Verdict</h2><p>2025 brings an incredible selection of tech gadgets to Amazon. All products featured are available with Prime shipping.</p>\n\n<div class=\"related-articles-section\">\n    <h3>Related Articles</h3>\n    <ul>\n        <li><a href=\"article.html?id=best-smart-home-devices-2025\">For home automation, see Best Smart Home Devices 2025</a></li>\n        <li><a href=\"article.html?id=best-wireless-earbuds-2025\">For audio, check Best Wireless Earbuds 2025</a></li>\n    </ul>\n</div>",
  "affiliateLinks": [
    {
      "label": "iPhone 16 Pro Max",
      "url": "https://www.amazon.com/s?k=iphone+16+pro+max&tag=kimsondreams-21"
    },
    {
      "label": "Samsung Galaxy S25 Ultra",
      "url": "https://www.amazon.com/s?k=samsung+galaxy+s25+ultra&tag=kimsondreams-21"
    },
    {
      "label": "Sony WH-1000XM5",
      "url": "https://www.amazon.com/s?k=sony+wh-1000xm5&tag=kimsondreams-21"
    },
    {
      "label": "AirPods Pro 2nd Gen",
      "url": "https://www.amazon.com/s?k=airpods+pro+2nd+generation&tag=kimsondreams-21"
    },
    {
      "label": "MacBook Air 15 M3",
      "url": "https://www.amazon.com/s?k=macbook+air+15+m3&tag=kimsondreams-21"
    },
    {
      "label": "ASUS ROG Zephyrus G14",
      "url": "https://www.amazon.com/s?k=asus+rog+zephyrus+g14+2025&tag=kimsondreams-21"
    }
  ]
}