{
  "id": "june-2026-tech-guide-wwdc-rumors",
  "title": "The Ultimate June 2026 Tech Guide: Father's Day AI Gifts & WWDC Wearables",
  "subtitle": "From AI-powered Father's Day gifts to the latest WWDC 2026 rumors, here is everything you need to know this June.",
  "author": "Technova Team",
  "date": "2026-03-06",
  "category": "ANNOUNCEMENTS",
  "tags": ["Tech", "AI", "Apple", "Wearables", "Gadgets", "Hardware"],
  "image": "images/articles/june-2026-tech-guide-main.jpg",
  "content": "<p>As we enter June 2026, the technology landscape is buzzing with anticipation. This month marks a perfect storm of consumer tech milestones: the search for the perfect AI-driven Father's Day gift, the groundbreaking reveals expected at WWDC 2026, and the hardware powerhouses debuting at Computex. In this guide, we break down the essential trends and products defining early summer 2026.</p>\n\n<h2>Father's Day 2026: The Year of the AI Companion</h2>\n<p>Gone are the days of simple gadgets. For Father's Day 2026, the most sought-after gifts are those that integrate seamlessly into a father's lifestyle using advanced AI. We are seeing a shift toward 'Agentic AI'—devices that don't just wait for commands but actively assist in health management and productivity.</p>\n\n<h3>AI Wearables for Dad: Apple Watch & Smart Rings</h3>\n<p>The <strong>Apple Watch Series 11</strong> has become the gold standard for health tracking, but 2026 is also the year of the smart ring. The <strong>Samsung Galaxy Ring</strong> offers a discreet alternative for dads who want 24/7 health monitoring without the bulk of a traditional watch. These devices now use predictive AI to alert users of potential health issues before they become symptoms.</p>\n\n<h3>Smart Home & Outdoor Tech</h3>\n<p>For the dad who loves the outdoors, AI-enhanced grills and climate-controlled apparel are trending. The <strong>Torras Coolify Cyber</strong> remains a top pick, providing personal cooling that adjusts based on ambient temperature and the user's biometric data, ensuring comfort during the summer heat.</p>\n\n<h2>WWDC 2026 Preview: Apple Intelligence 2.0</h2>\n<p>Apple's Worldwide Developers Conference (WWDC) 2026 is expected to be the most significant software event in years. Rumors suggest the unveiling of <strong>Apple Intelligence 2.0</strong>, which will move beyond text generation into full-system automation. iOS 20 is rumored to feature a 'Proactive Siri' that can handle complex multi-app workflows autonomously. Furthermore, we expect a sneak peek at the Apple Watch Series 12, which may finally include the long-awaited non-invasive blood pressure sensor.</p>\n\n<h2>Computex 2026: The Next Gen of AI PCs</h2>\n<p>In Taipei, Computex 2026 is showcasing the raw power behind the AI revolution. NVIDIA's <strong>Rubin architecture</strong> is the star of the show, powering a new generation of RTX 50-series mobile GPUs. Laptops like the <strong>ASUS ROG Zephyrus G14 (2026)</strong> are leveraging these chips to provide local AI processing speeds that were previously only possible on massive desktop rigs.</p>\n\n<div class=\"product-recommendation\">\n    <h3>Where to Buy: Top Recommendations</h3>\n    <p>Ready to upgrade or find the perfect gift? Here are our top picks for June 2026:</p>\n    <ul>\n        <li><strong>Apple Watch Series 11:</strong> The ultimate wearable for the Apple ecosystem. <a href=\"https://www.amazon.com/dp/B0DGBC6S7P?tag=kimsondreams-21\" target=\"_blank\" rel=\"noopener\">Check Price on Amazon</a></li>\n        <li><strong>Samsung Galaxy Ring:</strong> Cutting-edge health tracking in a sleek form factor. <a href=\"https://www.amazon.com/dp/B0D8T9S3S6?tag=kimsondreams-21\" target=\"_blank\" rel=\"noopener\">Check Price on Amazon</a></li>\n        <li><strong>Torras Coolify Cyber:</strong> Stay cool with the most advanced personal neck air conditioner. <a href=\"https://www.amazon.com/dp/B0CPY2X2Y7?tag=kimsondreams-21\" target=\"_blank\" rel=\"noopener\">Check Price on Amazon</a></li>\n    </ul>\n</div>"
}