{
  "id": "google-io-2026-agentic-android-preview",
  "title": "Google I/O 2026: Android 17 & Gemini 3.0 Agentic AI Guide",
  "subtitle": "Explore how Google I/O 2026 and Android 17 redefine mobile with Gemini 3.0. Learn about Intent-Based UI, Tensor G6, and the future of AI agents.",
  "author": "Technova Team",
  "date": "2026-03-06",
  "category": "ANNOUNCEMENTS",
  "tags": [
    "Tech",
    "AI",
    "Google",
    "Android 17",
    "Gemini 3.0",
    "Smart Home",
    "Gadgets"
  ],
  "image": "images/articles/google-io-2026-main.jpg",
  "gallery": [
    {
      "src": "images/articles/google-io-2026-main.jpg",
      "alt": "Google I/O 2026 keynote stage preview showing Gemini 3.0 branding",
      "caption": "Google I/O 2026: A new era of Agentic AI."
    },
    {
      "src": "images/articles/google-io-2026-agentic-ui.jpg",
      "alt": "Android 17 Intent-Based UI on a modern smartphone",
      "caption": "The new Intent-Based UI in Android 17."
    }
  ],
  "content": "<p>As we approach May 2026, the tech world is buzzing with anticipation for Google I/O. This year, the focus isn't just on incremental updates or new hardware; it's about a fundamental shift in how we interact with our devices. Google is poised to unveil Android 17, an operating system that promises to move beyond the traditional 'app-grid' model toward a truly agentic experience powered by Gemini 3.0.</p>\n\n<h2>Android 17: From Apps to Autonomous Agents</h2>\n<p>For over a decade, the smartphone experience has been defined by opening and closing apps. Android 17 aims to break this cycle with what Google calls 'Intent-Based UI.' Instead of you navigating through three different apps to book a dinner, manage your calendar, and send an invite, Gemini 3.0 will act as a proactive agent. By understanding your intent, the OS can execute these multi-step tasks in the background, presenting you only with the final confirmation.</p>\n\n<div class=\"article-image-wrapper\">\n    <img src=\"images/articles/google-io-2026-agentic-ui.jpg\" alt=\"A modern smartphone displaying advanced AI agent capabilities and intent-based UI in Android 17\" class=\"article-image\">\n    <p class=\"image-caption\">Android 17: A shift from manual app navigation to autonomous AI agents.</p>\n</div>\n\n<h2>Gemini 3.0: The Brain of the Ecosystem</h2>\n<p>The heart of this transformation is Gemini 3.0. Rumors suggest that this new iteration of Google's large language model features significantly improved multi-step reasoning and a much larger context window. More importantly, Gemini 3.0 is designed for local execution on the upcoming Tensor G6 chips. This means your personal AI agent can process sensitive data and perform complex tasks without ever sending your information to the cloud, ensuring both speed and privacy.</p>\n\n<h2>Hardware Synergy: Pixel 10 Pro and Tensor G6</h2>\n<p>While Android 17 is the star of the show, the hardware enabling it is equally impressive. The Pixel 10 Pro, expected to be teased at I/O, will likely feature the Tensor G6\u2014Google's most ambitious silicon to date. This chip is rumored to include a dedicated 'Agentic Engine' designed specifically to handle 24/7 proactive AI assistance. This hardware-software synergy is what will allow your phone to monitor your needs and provide assistance without significant battery drain.</p>\n\n<h2>Privacy and the 'Agentic' Boundary</h2>\n<p>With great power comes great responsibility, and Google is acutely aware of the privacy concerns surrounding autonomous agents. Android 17 is expected to introduce 'Agentic Permissions,' a new security framework that gives users granular control over what their AI agents can see and do. Whether it's accessing your emails to summarize a trip or managing your smart home devices, you remain in the driver's seat with clear visual indicators whenever an agent is active.</p>\n\n<div class=\"product-recommendation\">\n    <h3>Where to Buy Current Google Tech</h3>\n    <p>While we wait for the official launch of Android 17 and the Pixel 10 series, you can experience the cutting edge of Google's current AI ecosystem with these top-rated devices on Amazon:</p>\n    <ul>\n        <li><a href=\"https://www.amazon.com/s?k=google+pixel+9+pro&tag=kimsondreams-21\" target=\"_blank\" rel=\"noopener\">Shop Google Pixel 9 Pro on Amazon</a></li>\n        <li><a href=\"https://www.amazon.com/s?k=google+pixel+watch+3&tag=kimsondreams-21\" target=\"_blank\" rel=\"noopener\">Shop Google Pixel Watch 3 on Amazon</a></li>\n        <li>Check out our <a href=\"2026-wearable-tech-health-gadgets-guide\">2026 Wearable Tech & Health Gadgets Guide</a> for more on the latest AI wearables.</li>\n        <li><a href=\"https://www.amazon.com/s?k=google+nest+hub+max&tag=kimsondreams-21\" target=\"_blank\" rel=\"noopener\">Shop Google Nest Hub Max on Amazon</a></li>\n    </ul>\n</div>"
}