{
  "id": "best-gaming-headsets-2025",
  "title": "Best Gaming Headsets 2025",
  "date": "2025-01-01",
  "content": "<p>Content lost during corruption.</p>\n\n<div class=\"related-articles-section\">\n    <h3>Related Articles</h3>\n    <ul>\n        <li><a href=\"article.html?id=best-mechanical-keyboards-2025\">Complete your gaming setup with our Best Mechanical Keyboards 2025 guide</a></li>\n        <li><a href=\"article.html?id=best-4k-monitors-2025\">Pair with our Best 4K Monitors 2025 for the ultimate gaming experience</a></li>\n    </ul>\n</div>\n<p><i>SEO Update: As we look into the future of technology, understanding the impact of best foldable phones 2025 is crucial for staying ahead in 2025.</i></p>",
  "category": "COMPARISONS",
  "tags": [
    "2025",
    "Gaming",
    "Best",
    "Headsets"
  ],
  "subtitle": "A deep dive into best foldable phones 2025 and its implications for 2025.",
  "image": "images/articles/cover_best-gaming-headsets-2025_1772533935657.jpg",
  "author": "Technova Team"
}