{
  "id": "iphone-16-pro-max-review",
  "title": "iPhone 16 Pro Max Review: Apple's Most Powerful Smartphone Yet",
  "subtitle": "The new flagship sets a new standard for performance and camera capabilities",
  "author": "TechVanguard",
  "date": "2024-09-25",
  "category": "REVIEWS",
  "tags": [
    "Apple",
    "iPhone",
    "Smartphones",
    "Mobile"
  ],
  "image": "images/articles/iphone-16-pro-max.jpg",
  "content": "<p>Apple's latest flagship smartphone, the iPhone 16 Pro Max, has finally arrived, and it's nothing short of revolutionary. After spending two weeks with this device, I can confidently say it represents the most significant leap forward in iPhone history, combining cutting-edge technology with Apple's signature design philosophy.</p>\n\n<h2>Design and Build Quality</h2>\n\n<p>The iPhone 16 Pro Max features a refined design that builds upon its predecessors while introducing the new Grade 5 Titanium finish. This material not only makes the device incredibly durable but also remarkably light for its size. The new Camera Control button, located on the right side, adds a tactile dimension to the photography experience that was previously missing.</p>\n\n<h2>Display and Performance</h2>\n\n<p>The 6.9-inch Super Retina XDR display is the largest ever on an iPhone, with even thinner borders that make the screen feel truly edge-to-edge. Under the hood, the A18 Pro chip delivers blistering performance, handling intensive gaming and AI tasks with ease. Apple Intelligence features are deeply integrated, making everyday tasks faster and more intuitive.</p>\n\n<h2>Camera System</h2>\n\n<p>The new 48MP Fusion camera and the improved Ultra Wide lens capture stunning detail in all lighting conditions. The 5x Telephoto lens is now standard on the Pro Max, allowing for incredible zoom capabilities without losing clarity. Video recording has also seen a major upgrade with 4K 120fps Dolby Vision, providing cinema-quality footage right from your pocket.</p>\n\n<h2>Battery Life</h2>\n\n<p>Battery life has seen a significant boost, easily lasting through a full day of heavy use. With the efficiency of the A18 Pro chip and a larger internal battery, the iPhone 16 Pro Max is a true endurance champion.</p>\n\n<div class=\"related-articles-section\">\n    <h3>Related Articles</h3>\n    <ul>\n        <li><a href=\"article.html?id=apple-watch-ultra-2-review\">Check out our full Apple Watch Ultra 2 Review: The Ultimate Rugged Smartwatch</a></li>\n        <li><a href=\"article.html?id=best-amazon-gadgets-march-2025\">Read more about Best Amazon Gadgets March 2025: Top Tech Picks Reviewed</a></li>\n        <li><a href=\"article.html?id=top-5-flagship-gadgets-2025\">Read more about Top 5 Flagship Tech Gadgets of 2025: The Ultimate Comparison</a></li>\n    </ul>\n</div>\n<p><i>SEO Update: As we look into the future of technology, understanding the impact of best foldable phones 2025 is crucial for staying ahead in 2025.</i></p>"
}