{
  "id": "july-2026-tech-buying-guide",
  "title": "Prime Day 2026 & Back-to-School: The Ultimate AI Tech Buying Guide",
  "subtitle": "Mastering the 2026 AI Hardware Transition: From Next-Gen Copilot+ Laptops to Samsung's Foldable Revolution",
  "author": "Technova Team",
  "date": "2026-03-06",
  "category": "COMPARISONS",
  "tags": ["Tech", "AI", "Hardware", "Smartphone", "Productivity", "Gaming"],
  "image": "images/articles/july-2026-tech-guide-main.jpg",
  "content": "<p>As we approach the mid-point of 2026, the technology landscape has undergone its most significant shift in a decade. The 'AI PC' is no longer a marketing buzzword; it is the standard. With Prime Day 2026 on the horizon and the Back-to-School shopping season beginning in earnest, choosing the right hardware requires a new set of criteria. We are no longer just comparing clock speeds; we are comparing TOPS (Tera Operations Per Second) and local LLM efficiency.</p>\n\n<h2>Prime Day 2026: Predicted Dates and Deal Strategy</h2>\n<p>Based on historical patterns, <strong>Amazon Prime Day 2026 is expected to fall on July 14-15</strong>. While flagship AI laptops usually see their deepest discounts during the August Back-to-School window, Prime Day remains the premier time to secure 'ecosystem' hardware. This year, focus your search on high-speed NVMe SSDs (essential for local AI model caching), high-capacity power banks for power-hungry NPUs, and Amazon's own Echo line, which now features fully integrated generative AI agents.</p>\n\n<div class=\"article-image-wrapper\">\n    <img src=\"images/articles/july-2026-tech-guide-deals.jpg\" alt=\"A conceptual view of Prime Day 2026 tech deals\" class=\"article-image\">\n    <p class=\"image-caption\">Strategic shopping during Prime Day can save hundreds on AI-ready peripherals.</p>\n</div>\n\n<h2>The AI Laptop Revolution: Back-to-School Picks</h2>\n<p>For students and professionals heading into the 2026/2027 academic year, the choice between silicon architectures has never been more critical. The second generation of AI-first chips has arrived, offering unprecedented efficiency.</p>\n\n<h3>Snapdragon X Elite 2: The Battery Life King</h3>\n<p>The 2026 refresh of Qualcomm's flagship silicon brings a staggering 55+ NPU TOPS to the table. More importantly, real-world testing shows these machines consistently hitting 24 hours of battery life even with active AI background tasks. For students who spend all day on campus without a charger, this is the definitive choice.</p>\n\n<h3>Intel Lunar Lake 2: Performance Meets AI Efficiency</h3>\n<p>Intel's refined Lunar Lake 2 architecture has closed the efficiency gap while maintaining its lead in single-core performance. It is the preferred choice for creative students using Adobe Firefly or local video upscaling, where the integration between the GPU and NPU is most mature.</p>\n\n<h2>Samsung Unpacked July 2026: Foldables & Wearables</h2>\n<p>The late July Samsung Unpacked event is rumored to showcase the <strong>Galaxy Z Fold 8</strong>. Early leaks suggest a move to the Snapdragon 8 Gen 5 and a significantly thinner 12.1mm chassis. For those looking for a deal, the strategy here is 'Trade-In.' Samsung historically offers massive bonuses for previous-gen devices during the launch window, often making the upgrade cheaper than buying a mid-range phone outright.</p>\n\n<h2>Buying-Timeline Checklist: Prime Day vs. Back-to-School</h2>\n<div class=\"table-responsive\">\n<table class=\"article-table\">\n    <thead>\n        <tr>\n            <th>Category</th>\n            <th>Best Time</th>\n            <th>Target Discount</th>\n            <th>Recommended Action</th>\n        </tr>\n    </thead>\n    <tbody>\n        <tr>\n            <td>Laptops (AI-PC)</td>\n            <td>Late July (BTS)</td>\n            <td>15-20% + Bundles</td>\n            <td>Wait for student bundles with free earbuds or software.</td>\n        </tr>\n        <tr>\n            <td>Storage/SSDs</td>\n            <td>Prime Day</td>\n            <td>30-40%</td>\n            <td>Buy now; AI models require fast local caching.</td>\n        </tr>\n        <tr>\n            <td>Smartphones</td>\n            <td>Late July (Unpacked)</td>\n            <td>Trade-in Focus</td>\n            <td>Use trade-in bonuses for Z Fold 8/Flip 8.</td>\n        </tr>\n        <tr>\n            <td>AI Gadgets <$200</td>\n            <td>Prime Day</td>\n            <td>25%</td>\n            <td>Great for Rabbit R1 successors or AI-first peripherals.</td>\n        </tr>\n    </tbody>\n</table>\n</div>\n\n<div class=\"product-recommendation\">\n    <h3>Where to Buy</h3>\n    <p>Secure the best deals on the latest AI hardware through these verified search portals:</p>\n    <ul>\n        <li><a href=\"https://www.amazon.com/s?k=snapdragon+x+elite+2+laptop&tag=kimsondreams-21\" target=\"_blank\" rel=\"noopener\">Shop Snapdragon X Elite 2 Laptops</a></li>\n        <li><a href=\"https://www.amazon.com/s?k=intel+lunar+lake+2+laptop&tag=kimsondreams-21\" target=\"_blank\" rel=\"noopener\">Shop Intel Lunar Lake 2 Laptops</a></li>\n        <li><a href=\"https://www.amazon.com/s?k=samsung+galaxy+z+fold+8&tag=kimsondreams-21\" target=\"_blank\" rel=\"noopener\">Samsung Galaxy Z Fold 8 Pre-order Search</a></li>\n        <li><a href=\"https://www.amazon.com/s?k=ai+gadgets+under+200&tag=kimsondreams-21\" target=\"_blank\" rel=\"noopener\">Best AI Gadgets under $200</a></li>\n    </ul>\n</div>\n\n<h2>Frequently Asked Questions</h2>\n<p><strong>Is 16GB RAM enough for 2026 AI tasks?</strong><br>In 2026, 16GB is the absolute minimum for Copilot+ PCs. For future-proofing, 32GB is highly recommended for local LLM execution and multitasking.</p>\n<p><strong>Should I buy a laptop on Prime Day or wait for August?</strong><br>If you are a student, wait for late July or early August 'Back-to-School' bundles. These often include high-value accessories like premium noise-canceling headphones for free with the laptop purchase.</p>"
}