{
  "id": "best-tech-gadgets-comparison-2025",
  "title": "Best Tech Gadgets Comparison 2025: Top Picks Across Categories",
  "subtitle": "We compare the hottest smartphones, audio gear, laptops, and smart home devices available on Amazon this year",
  "author": "Technova Team",
  "date": "2025-03-01",
  "category": "COMPARISONS",
  "tags": [
    "Tech",
    "Gadgets",
    "Amazon",
    "Smartphone",
    "Audio",
    "Laptop",
    "Smart Home",
    "Comparison"
  ],
  "image": "images/articles/cover_best-tech-gadgets-comparison-2025_1772533800756.jpg",
  "content": "<p>Looking for the best tech gadgets on Amazon in 2025? We have tested dozens of products across multiple categories to bring you this comprehensive comparison guide.</p><h2>Our Top Picks</h2><table class=comparison-table><thead><tr><th>Product</th><th>Category</th><th>Best For</th></tr></thead><tbody><tr><td>iPhone 16 Pro Max</td><td>Smartphone</td><td>Best Overall</td></tr><tr><td>Sony WH-1000XM5</td><td>Audio</td><td>Best Noise Cancelling</td></tr><tr><td>MacBook Air M3</td><td>Laptop</td><td>Best Value</td></tr><tr><td>Amazon Echo Show 15</td><td>Smart Home</td><td>Best Smart Display</td></tr></tbody></table><h2>Best Smartphone: iPhone 16 Pro Max</h2><p>Apples iPhone 16 Pro Max represents the pinnacle of smartphone technology in 2025. With the powerful A18 Pro chip, improved camera system, and all-day battery life.</p><h3>Where to Buy</h3><p><a href=https://www.amazon.com/dp/B0DHJ896RY?tag=kimsondreams-21 target=_blank rel=noopener>Buy iPhone 16 Pro Max on Amazon</a></p><h2>Best Headphones: Sony WH-1000XM5</h2><p>The Sony WH-1000XM5 continues Sonys legacy of excellence in noise-cancelling headphones with improved ANC and 30-hour battery life.</p><h3>Where to Buy</h3><p><a href=https://www.amazon.com/dp/B09XS7JWHH?tag=kimsondreams-21 target=_blank rel=noopener>Buy Sony WH-1000XM5 on Amazon</a></p><h2>Best Laptop: MacBook Air M3</h2><p>The MacBook Air M3 is the perfect laptop for most people with incredible performance and all-day battery life.</p><h3>Where to Buy</h3><p><a href=https://www.amazon.com/dp/B0CX23GFMJ?tag=kimsondreams-21 target=_blank rel=noopener>Buy MacBook Air M3 on Amazon</a></p><h2>Best Smart Home: Amazon Echo Show 15</h2><p>The Amazon Echo Show 15 serves as a digital command center for your entire smart home setup with 15.6-inch Full HD screen.</p><h3>Where to Buy</h3><p><a href=https://www.amazon.com/dp/B08MQLDG8H?tag=kimsondreams-21 target=_blank rel=noopener>Buy Amazon Echo Show 15 on Amazon</a></p><h2>Conclusion</h2><p>The tech gadgets recommended represent the best options in their respective categories for 2025.</p>\n\n<div class=\"related-articles-section\">\n    <h3>Related Articles</h3>\n    <ul>\n        <li><a href=\"article.html?id=ai-assistants-comparison-2025\">See how it compares in our AI Assistants Comparison 2025</a></li>\n        <li><a href=\"article.html?id=apple-watch-ultra-2-review\">Check out our full Apple Watch Ultra 2 Review: The Ultimate Rugged Smartwatch</a></li>\n        <li><a href=\"article.html?id=best-amazon-gadgets-march-2025\">Read more about Best Amazon Gadgets March 2025: Top Tech Picks Reviewed</a></li>\n    </ul>\n</div>\n<p><i>SEO Update: As we look into the future of technology, understanding the impact of best foldable phones 2025 is crucial for staying ahead in 2025.</i></p>"
}