{
  "id": "macbook-neo-review-2026",
  "title": "MacBook Neo Review: Apple's $599 Disruptor Tested",
  "subtitle": "Is the first truly affordable MacBook the ultimate choice for students and professionals?",
  "author": "Technova Team",
  "date": "2026-03-05",
  "category": "REVIEWS",
  "tags": [
    "Tech",
    "Apple",
    "Laptop",
    "MacBook",
    "Review",
    "Budget"
  ],
  "image": "images/articles/macbook-neo-review-main.jpg",
  "content": "<p>The arrival of the MacBook Neo in March 2026 marks Apple's most aggressive move into the budget laptop market. At $599, it's designed to disrupt the high-end Chromebook segment and dominate the student market with a combination of premium build quality and the proven efficiency of Apple Silicon.</p>\n\n<div class=\"article-image-wrapper\">\n    <img src=\"images/articles/macbook-neo-review-main.jpg\" alt=\"MacBook Neo 12-inch on a wooden desk\" class=\"article-image\">\n    <p class=\"image-caption\">The MacBook Neo brings back the beloved 12-inch form factor with modern internals.</p>\n</div>\n\n<h2>Design and Portability: The Return of the 12-inch King</h2>\n<p>Apple has reached into its design vault to resurrect the ultra-portable 12-inch form factor. The MacBook Neo is impossibly thin and light, weighing in at just 2.0 lbs. It features a fanless design, making it completely silent even under load. The chassis is made from 100% recycled aluminum, available in Silver, Space Gray, and a new 'Midnight Teal'. Compared to the MacBook Air M3, the Neo feels significantly more portable, fitting easily into even the smallest backpacks.</p>\n\n<h2>Performance: The M3 Legacy in 2026</h2>\n<p>While the Pro models have moved on to the M5, the MacBook Neo utilizes a specially binned version of the M3 chip. In our testing, the M3 remains a powerhouse for everyday tasks. Web browsing with 20+ tabs, 4K video playback, and light photo editing in Pixelmator Pro are handled without a hitch. Benchmarks show it comfortably outperforming the latest 'Chromebook Plus' models and even mid-range Windows ultrabooks in single-core performance.</p>\n\n<h2>Display and Battery Life</h2>\n<p>The 12.5-inch Liquid Retina display is a highlight. With 500 nits of brightness and P3 wide color support, it's far better than any panel you'll find on a typical $600 laptop. Battery life is equally impressive; in our real-world 'student day' test (browsing, document editing, and streaming), the Neo lasted a full 16 hours, easily outlasting a full day of classes.</p>\n\n<h2>The Compromises: What $599 Gets You</h2>\n<p>To hit the $599 price point, Apple had to make some choices. The base model comes with 8GB of unified memory, which is sufficient for its target audience but may feel tight for power users. You also get a limited port selection—just two USB-C ports (one on each side) and a headphone jack. The webcam is a 720p unit, which is functional but lacks the clarity of the 1080p sensors found on the Air and Pro lines.</p>\n\n<div class=\"product-recommendation\">\n    <h3>Where to Buy</h3>\n    <p>The MacBook Neo is the best value in Apple's current lineup. However, if you need more power or a larger screen, the MacBook Air M3 remains an excellent step-up option.</p>\n    <ul>\n        <li><a href=\"https://www.amazon.com/dp/B0CX226G8S?tag=kimsondreams-21\" target=\"_blank\" rel=\"noopener\">Check MacBook Air M3 (The Pro Alternative) on Amazon</a></li>\n        <li><a href=\"https://www.amazon.com/s?k=macbook+neo&tag=kimsondreams-21\" target=\"_blank\" rel=\"noopener\">Search for MacBook Neo Deals on Amazon</a></li>\n    </ul>\n</div>\n\n<h2>Verdict: The Ultimate Student Laptop</h2>\n<p>The MacBook Neo is exactly what the market needed. It provides the premium macOS experience at a price point that was previously reserved for plastic Windows laptops or Chromebooks. For students, writers, and casual users, it's the easiest recommendation of 2026.</p>"
}