{
    "id": "4",
    "title": "Back to School Tech Essentials: Must-Have Gadgets for Students in 2024",
    "subtitle": "A guide to the best tech gear for students heading back to class.",
    "author": "CircuitBreaker",
    "date": "August 15, 2024",
    "category": "PROMOTIONS",
    "tags": [
        "Back to School",
        "Tech Essentials",
        "Students",
        "Gadgets"
    ],
    "image": "https://images.unsplash.com/photo-1510017803434-a899398421b3?auto=format&fit=crop&w=800&q=80",
    "content": "<p>Heading back to school in 2024? Equip yourself with the latest tech essentials to boost productivity, learning, and fun. Here are the top gadgets every student should consider this year.</p>\n\n<h2>1. MacBook Air M4</h2>\n<p>Lightweight, powerful, and perfect for note-taking and projects. <a href=\"https://www.amazon.com/s?k=macbook+air+m4&tag=kimsondreams-20\" target=\"_blank\" rel=\"noopener\">Check deal</a></p>\n\n<h2>2. Samsung Galaxy Tab S9</h2>\n<p>Versatile tablet for studying, drawing, and entertainment. <a href=\"https://www.amazon.com/s?k=samsung+galaxy+tab+s9&tag=kimsondreams-20\" target=\"_blank\" rel=\"noopener\">Check deal</a></p>\n\n<h2>3. Sony WH-1000XM5 Headphones</h2>\n<p>Block out distractions with industry-leading noise cancellation. <a href=\"https://www.amazon.com/dp/B0B6ZJZJ1P?tag=kimsondreams-20\" target=\"_blank\" rel=\"noopener\">Check deal</a></p>\n\n<h2>4. Anker PowerCore Portable Charger</h2>\n<p>Stay powered up on the go. <a href=\"https://www.amazon.com/s?k=anker+powercore&tag=kimsondreams-20\" target=\"_blank\" rel=\"noopener\">Check deal</a></p>\n\n<h2>5. Logitech MX Master 3S Mouse</h2>\n<p>Boost productivity with a precision wireless mouse. <a href=\"https://www.amazon.com/dp/B09HM94VDS?tag=kimsondreams-20\" target=\"_blank\" rel=\"noopener\">Check deal</a></p>\n\n<h2>6. Kindle Paperwhite</h2>\n<p>Carry thousands of books in one device. <a href=\"https://www.amazon.com/dp/B08KTZ8249?tag=kimsondreams-20\" target=\"_blank\" rel=\"noopener\">Check deal</a></p>\n\n<h2>7. HP DeskJet 4155e Printer</h2>\n<p>Affordable, wireless printing for assignments and projects. <a href=\"https://www.amazon.com/dp/B08XYRDKDM?tag=kimsondreams-20\" target=\"_blank\" rel=\"noopener\">Check deal</a></p>\n\n<h2>8. Samsung T7 Portable SSD</h2>\n<p>Fast, reliable storage for files and backups. <a href=\"https://www.amazon.com/dp/B0874XN4D8?tag=kimsondreams-20\" target=\"_blank\" rel=\"noopener\">Check deal</a></p>\n\n<h2>9. Rocketbook Smart Reusable Notebook</h2>\n<p>Digitize handwritten notes with ease. <a href=\"https://www.amazon.com/dp/B071Y3MSRK?tag=kimsondreams-20\" target=\"_blank\" rel=\"noopener\">Check deal</a></p>\n\n<h2>10. Blue Yeti USB Microphone</h2>\n<p>Perfect for online classes and podcasting. <a href=\"https://www.amazon.com/dp/B00N1YPXW2?tag=kimsondreams-20\" target=\"_blank\" rel=\"noopener\">Check deal</a></p>\n\n<div class=\"product-recommendation\">\n    <h3>Where to Buy</h3>\n    <p>All products are available on <a href=\"https://www.amazon.com/backtoschool?tag=kimsondreams-20\" target=\"_blank\" rel=\"noopener\">Amazon Back to School</a> for the best prices and fast shipping.</p>\n</div>\n\n<p><strong>Summary:</strong> These tech essentials will help students stay organized, productive, and connected throughout the school year.</p>"
}