{
  "id": "samsung-galaxy-s26-ultra-review",
  "title": "Samsung Galaxy S26 Ultra Review: The Ultimate AI Phone?",
  "subtitle": "Samsung's 2026 flagship brings a revolutionary Privacy Display and next-gen Galaxy AI.",
  "author": "Technova Team",
  "date": "2026-03-05",
  "category": "REVIEWS",
  "tags": [
    "Tech",
    "Samsung",
    "Smartphone",
    "Review",
    "AI"
  ],
  "image": "images/articles/samsung-galaxy-s26-ultra-official.jpg",
  "content": "<p>The Samsung Galaxy S26 Ultra has officially arrived, and it's not just another incremental update. While the silhouette remains familiar, the technology packed inside represents a significant leap forward for the Android ecosystem in 2026.</p><h2>The Revolutionary Privacy Display</h2><p>The standout feature this year is the new 6.9-inch 'Privacy Display'. Using advanced micro-louver technology integrated directly into the OLED stack, the screen can automatically narrow its viewing angles when it detects someone nearby looking at your phone. It's a game-changer for commuters and professionals alike.</p><h2>Performance: Snapdragon 8 Elite Gen 5</h2><p>Under the hood, the S26 Ultra is powered by the Snapdragon 8 Elite Gen 5 chipset paired with 16GB of RAM. In our benchmarks, this combination delivers a 30% boost in multi-core performance compared to last year's model, making it the fastest smartphone we've ever tested. Galaxy AI is now faster than ever, handling complex photo editing and real-time translation entirely on-device.</p><h2>Camera and Battery</h2><p>The 200MP main sensor has been refined with better low-light processing, and the new 50MP 5x telephoto lens provides stunning clarity even at hybrid 100x zoom. The 5000 mAh battery easily lasts a full day of heavy use, and the 45W wired charging gets you from 0 to 70% in just 30 minutes.</p><div class=\"product-recommendation\"><h3>Where to Buy</h3><p>The Samsung Galaxy S26 Ultra is available now on Amazon. You can find the latest deals and bundles, including the 512GB storage variant, via the link below:</p><p><a href=\"https://www.amazon.com/dp/B0GGTVNKGP?tag=kimsondreams-21\" target=\"_blank\" rel=\"noopener\">Check Samsung Galaxy S26 Ultra Price on Amazon</a></p></div>"
}