{
  "id": "top-ai-gadgets-amazon-2025",
  "title": "Top AI Gadgets Available on Amazon 2025: Smart Home Revolution",
  "subtitle": "Discover the best AI-powered devices transforming homes in 2025",
  "author": "Technova Team",
  "date": "2025-03-01",
  "category": "REVIEWS",
  "tags": [
    "AI",
    "Smart Home",
    "Tech",
    "Amazon",
    "Gadgets",
    "ioT"
  ],
  "image": "images/articles/cover_top-ai-gadgets-amazon-2025_1772534001676.jpg",
  "content": "<p>Artificial intelligence has revolutionized the smart home industry in 2025. From voice assistants to AI-powered security cameras, these gadgets make your home smarter and more efficient.</p><h2>1. Amazon Echo Show 15 with Alexa AI</h2><p>The Echo Show 15 features a 15.6-inch Full HD display and Fire TV built-in. Alexa AI understands context better than ever, managing your smart home devices seamlessly. The visual ID feature recognizes family members and provides personalized content.</p><div class=\"product-recommendation\"><h3>Where to Buy</h3><p><a href=\"https://www.amazon.com/s?k=echo+show+15&tag=kimsondreams-21\" target=\"_blank\" rel=\"noopener\">Check Price on Amazon</a></p></div><h2>2. Ring Battery Doorbell Plus with AI Detection</h2><p>Advanced AI person detection distinguishes between people, packages, and animals. 1536p HD video with Head-to-Toe view ensures you never miss a visitor. Bird Eye View provides aerial perspective of visitors.</p><div class=\"product-recommendation\"><h3>Where to Buy</h3><p><a href=\"https://www.amazon.com/s?k=ring+doorbell+plus&tag=kimsondreams-21\" target=\"_blank\" rel=\"noopener\">Check Price on Amazon</a></p></div><h2>3. Google Nest Hub Max (2nd Gen)</h2><p>Google Assistant with enhanced AI recognizes faces and provides personalized information. The 10-inch display serves as a digital photo frame and smart home control center. Gesture controls let you pause music or answer calls with a wave.</p><div class=\"product-recommendation\"><h3>Where to Buy</h3><p><a href=\"https://www.amazon.com/s?k=nest+hub+max&tag=kimsondreams-21\" target=\"_blank\" rel=\"noopener\">Check Price on Amazon</a></p></div><h2>4. Blink Outdoor 4 AI Security Camera</h2><p>AI-powered motion detection reduces false alerts. Two-year battery life and 1080p HD video make this the perfect outdoor security solution. Works seamlessly with Alexa for voice control.</p><div class=\"product-recommendation\"><h3>Where to Buy</h3><p><a href=\"https://www.amazon.com/s?k=blink+outdoor+4&tag=kimsondreams-21\" target=\"_blank\" rel=\"noopener\">Check Price on Amazon</a></p></div><h2>5. Philips Hue Smart Lighting with AI Scenes</h2><p>AI-driven lighting scenes adapt to your daily routine. Sync with music, movies, and games for immersive ambient lighting experiences. Voice control via Alexa, Google Assistant, and Siri.</p><div class=\"product-recommendation\"><h3>Where to Buy</h3><p><a href=\"https://www.amazon.com/s?k=philips+hue+starter+kit&tag=kimsondreams-21\" target=\"_blank\" rel=\"noopener\">Check Price on Amazon</a></p></div><h2>Final Verdict</h2><p>These AI-powered gadgets represent the best smart home technology available on Amazon in 2025. Each device brings unique AI capabilities to enhance your daily life, from voice recognition to automated routines.</p>\n\n<div class=\"related-articles-section\">\n    <h3>Related Articles</h3>\n    <ul>\n        <li><a href=\"article.html?id=apple-watch-ultra-2-review\">Check out our full Apple Watch Ultra 2 Review: The Ultimate Rugged Smartwatch</a></li>\n        <li><a href=\"article.html?id=best-amazon-gadgets-march-2025\">Read more about Best Amazon Gadgets March 2025: Top Tech Picks Reviewed</a></li>\n        <li><a href=\"article.html?id=best-gaming-accessories-2025\">Read more about Best Gaming Accessories 2025: Top Headsets, Keyboards, Mice & Controllers</a></li>\n    </ul>\n</div>"
}