{
  "id": "stress-test-2025",
  "title": "Stress Test Article 2025: Layout Verification",
  "subtitle": "Ensuring the new CSS handles dynamic content without overlapping",
  "author": "GAI Senior Engineer",
  "date": "2025-12-31",
  "category": "NEWS",
  "tags": ["Tech", "WebDev", "Testing"],
  "image": "images/articles/article6-cover.jpg",
  "content": "<p>This article serves as a final validation for the CSS refactoring task. We are testing the <b>glassmorphism</b> effects, the fluid typography, and the grid container constraints.</p><h2>Visual Consistency</h2><p>The header and footer should now be perfectly synchronized across the index and article pages. The use of CSS variables from design-system.css ensures that any future theme changes will propagate correctly.</p><div class='product-recommendation'><h3>Verified Gear</h3><p>Testing affiliate link: <a href='https://www.amazon.com/dp/B0C6J8JQ6K?tag=kimsondreams-21' target='_blank' rel='noopener'>Sony WH-1000XM5</a></p></div>"
}