{
  "id": "meta-quest-3s-review",
  "title": "Meta Quest 3S Review: The New King of Budget VR?",
  "subtitle": "Meta's latest headset brings Quest 3 power to a much more accessible price point.",
  "author": "Technova Team",
  "date": "2025-03-05",
  "category": "REVIEWS",
  "tags": [
    "Tech",
    "VR",
    "Meta",
    "Gaming",
    "Hardware"
  ],
  "image": "images/articles/tech-gadgets-2025-main.jpg",
  "content": "<p>The Meta Quest 3S has arrived, promising to democratize high-end mixed reality. By stripping away some of the premium flourishes of the standard Quest 3 while keeping the core processing power, Meta has created a compelling entry point for VR newcomers and upgraders alike.</p>\n\n<div class=\"article-image-wrapper\">\n    <img src=\"images/articles/cover_best-gaming-headsets-2025_1772533935657.jpg\" alt=\"VR Gaming Headset Experience\" class=\"article-image\">\n    <p class=\"image-caption\">The Quest 3S delivers a high-quality VR experience without the flagship price tag.</p>\n</div>\n\n<h2>Performance: No Compromises on Power</h2>\n\n<p>Under the hood, the Quest 3S is powered by the same <strong>Snapdragon XR2 Gen 2</strong> chipset found in its more expensive sibling. Paired with <strong>8GB of RAM</strong>, this means the 3S can run every game and application in the Quest library with the same performance as the flagship model. Loading times are snappy, and complex mixed reality experiences run without a hitch.</p>\n\n<h2>Display and Optics: The Trade-off</h2>\n\n<p>To hit the lower price point, Meta opted for <strong>Fresnel lenses</strong> instead of the pancake optics found on the Quest 3. The resolution stands at <strong>1832x1920 per eye</strong>. While you lose some of the edge-to-edge clarity and the slim profile of the pancake lenses, the visual experience remains sharp enough for most gaming and media consumption. The <strong>4MP RGB passthrough</strong> cameras ensure that mixed reality remains a core part of the experience, offering full-color views of your surroundings.</p>\n\n<h2>Design and Comfort</h2>\n\n<p>The headset is slightly bulkier than the Quest 3 due to the lens assembly, but it remains comfortable for extended sessions. It uses the same Touch Plus controllers, which lack the tracking rings of older models, making them much more ergonomic and less prone to clashing during intense gameplay.</p>\n\n<div class=\"product-recommendation\">\n    <h3>Where to Buy</h3>\n    <p>The Meta Quest 3S (128GB) is currently the best value in VR. You can find it on Amazon via the link below:</p>\n    <p><a href=\"https://www.amazon.com/dp/B0D9S4X4C9?tag=kimsondreams-21\" target=\"_blank\" rel=\"noopener\">Check Meta Quest 3S Price on Amazon</a></p>\n</div>\n\n<div class=\"related-articles-section\">\n    <h3>Related Articles</h3>\n    <ul>\n        <li><a href=\"article.html?id=best-gaming-accessories-2025\">Best Gaming Accessories 2025: Top Headsets and Gear</a></li>\n        <li><a href=\"article.html?id=top-ai-gadgets-amazon-2025\">Top AI Gadgets Available on Amazon 2025</a></li>\n    </ul>\n</div>"
}