{
  "id": "summer-2025-laptop-buying-guide",
  "title": "Summer 2025 Laptop Buying Guide",
  "date": "2025-01-01",
  "content": "<p>Content lost during corruption.</p>\n<p><i>SEO Update: As we look into the future of technology, understanding the impact of best foldable phones 2025 is crucial for staying ahead in 2025.</i></p>",
  "category": "COMPARISONS",
  "tags": [
    "Laptop",
    "2025",
    "Buying",
    "Guide",
    "Summer"
  ],
  "subtitle": "A deep dive into best foldable phones 2025 and its implications for 2025.",
  "image": "images/articles/cover_summer-2025-laptop-buying-guide_1772533844234.jpg",
  "author": "Technova Team"
}