{
  "id": "holiday-tech-gift-guide-2025",
  "title": "Ultimate Holiday Tech Gift Guide 2025: Top Picks for Every Budget",
  "subtitle": "From audiophile headphones to next-gen creators tools, here is what to buy this season.",
  "author": "NetRunner",
  "date": "2025-12-05",
  "category": "PROMOTIONS",
  "tags": [
    "Gift Guide",
    "Holiday 2025",
    "Tech Deals",
    "Gadgets",
    "Apple",
    "Sony"
  ],
  "image": "images/articles/generated/holiday-tech-gift-guide-2025-fallback-0.svg",
  "affiliateLinks": [
    {
      "label": "Sony WH-1000XM5",
      "url": "https://www.amazon.com/s?k=sony+wh-1000xm5&tag=kimsondreams-20"
    },
    {
      "label": "Apple Watch Ultra 2",
      "url": "https://www.amazon.com/s?k=apple+watch+ultra+2&tag=kimsondreams-20"
    },
    {
      "label": "DJI Osmo Pocket 3",
      "url": "https://www.amazon.com/s?k=dji+osmo+pocket+3&tag=kimsondreams-20"
    },
    {
      "label": "MacBook Pro",
      "url": "https://www.amazon.com/s?k=macbook+pro&tag=kimsondreams-20"
    }
  ],
  "content": "<p>The 2025 holiday season is upon us, and the world of technology has never been more exciting. Whether you are shopping for a creative professional, a fitness enthusiast, or just treating yourself, we have curated the top tech gifts that define this year.</p><h2>1. The Audio King: Sony WH-1000XM5</h2><p>Even in late 2025, the <strong>Sony WH-1000XM5</strong> remains the gold standard for noise-canceling headphones. With industry-leading ANC and 30-hour battery life, they are perfect for winter travel.</p><div class=\"product-recommendation\"><a href=\"https://www.amazon.com/s?k=sony+wh-1000xm5&tag=kimsondreams-20\" target=\"_blank\" rel=\"noopener\"><strong>Check Price on Amazon: Sony WH-1000XM5</strong></a></div><h2>2. For the Adventurer: Apple Watch Ultra 2</h2><p>Rugged, capable, and featuring the brightest display Apple has ever made. The Ultra 2 is the ultimate companion for winter sports and outdoor adventures.</p><div class=\"product-recommendation\"><a href=\"https://www.amazon.com/s?k=apple+watch+ultra+2&tag=kimsondreams-20\" target=\"_blank\" rel=\"noopener\"><strong>Check Price on Amazon: Apple Watch Ultra 2</strong></a></div><h2>3. The Creator's Tool: DJI Osmo Pocket 3</h2><p>For capturing holiday memories in stunning 4K, nothing beats the portability and stabilization of the Osmo Pocket 3. It features a 1-inch sensor that performs beautifully in low light.</p><div class=\"product-recommendation\"><a href=\"https://www.amazon.com/s?k=dji+osmo+pocket+3&tag=kimsondreams-20\" target=\"_blank\" rel=\"noopener\"><strong>Check Price on Amazon: DJI Osmo Pocket 3</strong></a></div><h2>4. Productivity Powerhouse: MacBook Pro M4</h2><p>Apple's M4 chips have redefined laptop performance. If you are looking for a gift that will last for years and handle any task, the new MacBook Pro is it.</p><div class=\"product-recommendation\"><a href=\"https://www.amazon.com/s?k=macbook+pro+m4&tag=kimsondreams-20\" target=\"_blank\" rel=\"noopener\"><strong[... 58 chars omitted ...]",
  "gallery": [
    {
      "src": "images/articles/generated/holiday-tech-gift-guide-2025-gen-1.svg",
      "alt": "Ultimate Holiday Tech Gift Guide 2025: Top Picks for Every Budget",
      "caption": ""
    },
    {
      "src": "images/articles/generated/holiday-tech-gift-guide-2025-gen-2.svg",
      "alt": "Ultimate Holiday Tech Gift Guide 2025: Top Picks for Every Budget",
      "caption": ""
    }
  ]
}
